{
  "id": "win1014-swing-profiles",
  "status": "observed",
  "claim": "The Windows v1.014 build contains 11 28-byte signed swing/accuracy profiles centered on zero, used to convert even signed accuracy-error offsets into swing-adjuster values.",
  "sources": [
    {
      "kind": "windows-executable",
      "source": "GOLFWIN.EXE v1.014 SHA256 3ab09a789ae3d11ffe6636def32f5d1c00f2930ad4068bf6dc1420ceac7f1ec8",
      "sha256": "3ab09a789ae3d11ffe6636def32f5d1c00f2930ad4068bf6dc1420ceac7f1ec8",
      "offset": null,
      "observation": "Profile extraction from VA 0x41F204 yields 11 rows of 14 signed 16-bit samples with symmetric or near-symmetric negative/zero/positive swing values."
    }
  ],
  "tests": [
    "tools/extract_swing_profiles.py"
  ],
  "notes": "Exact club/profile selection and any additional continuous curvature remain to be proven."
}
