{
  "id": "win1014-q14-trig",
  "status": "observed",
  "claim": "Direction is 12-bit (4096 units/circle) and horizontal projection uses a signed Q14 sine table with a 1024-step phase offset for the orthogonal component.",
  "sources": [
    {
      "kind": "windows-executable",
      "source": "GOLFWIN.EXE v1.014 SHA256 3ab09a789ae3d11ffe6636def32f5d1c00f2930ad4068bf6dc1420ceac7f1ec8",
      "sha256": "3ab09a789ae3d11ffe6636def32f5d1c00f2930ad4068bf6dc1420ceac7f1ec8",
      "offset": 0,
      "observation": "Update code masks direction with 0xFFF, indexes int16 table at VA 0x41A670 and +1024 entries, multiplies force and shifts 14 bits."
    }
  ],
  "tests": [
    "tools/analyze_trig_table.py: clean formula regenerated 5120 compared entries with zero mismatches",
    "engine/tests/recovered_math_tests.cpp: canonical angle/projection checks"
  ],
  "notes": "Still marked observed rather than parity-verified because tests compare static binary data/code semantics, not a runtime original-game trace."
}
