{
  "id": "v1014-generic-flat-full-shot-parity",
  "status": "parity-verified",
  "claim": "For three representative normal-club shots (straight, draw, fade), the portable recovered core reproduces the original Sensible Golf Windows v1.014 live-player launch, clear-air flight, generic flat-surface landing, bounce, roll and final rest exactly at zero tolerance.",
  "sources": [
    {
      "kind": "windows-executable",
      "source": "GOLFWIN.EXE v1.014",
      "sha256": "3ab09a789ae3d11ffe6636def32f5d1c00f2930ad4068bf6dc1420ceac7f1ec8",
      "offset": null,
      "observation": "Original live-player machine code executed under 32-bit x86 Unicorn; terrain lookup controlled to generic surface code 0 only."
    },
    {
      "kind": "black-box-trace",
      "source": "GitHub Actions run 37523005402 / artifact 11440508979",
      "observation": "Zero-tolerance traces: straight_1w 153 samples, draw_mid 131 samples, fade_high 111 samples; all state fields and landing/rest events matched exactly."
    }
  ],
  "tests": [
    ".github/workflows/golden-master-flat-rest.yml",
    "tools/compare_full_oracle.py",
    "engine/tests/recovered_ground_tests.cpp"
  ],
  "notes": "Compared fields: X, Y, height, vertical force, horizontal force, direction, swing adjuster, adjusted power. This verifies the controlled generic-flat path, not yet every terrain, hazard, green or cup rule."
}
