{
  "id": "win1014-ball-update",
  "status": "observed",
  "claim": "The Windows v1.014 ball loop applies gravity 0x2100/tick, normal rolling drag 0xF00, green drag 0x780, half-energy vertical bounce with quarter-transfer to horizontal force, and Q14 horizontal integration.",
  "sources": [
    {
      "kind": "windows-executable",
      "source": "GOLFWIN.EXE v1.014 SHA256 3ab09a789ae3d11ffe6636def32f5d1c00f2930ad4068bf6dc1420ceac7f1ec8",
      "sha256": "3ab09a789ae3d11ffe6636def32f5d1c00f2930ad4068bf6dc1420ceac7f1ec8",
      "offset": null,
      "observation": "Disassembly of VA 0x40CB00-0x40CCA4 shows the recovered arithmetic and branches directly."
    }
  ],
  "tests": [
    "engine/tests/recovered_math_tests.cpp: gravity, drag, bounce and horizontal projection unit tests"
  ],
  "notes": "Terrain terminal/special IDs and cup behaviour are deliberately excluded pending further mapping."
}
