{
  "id": "example-not-gameplay-evidence",
  "status": "hypothesis",
  "claim": "Replace this with one narrowly defined recovered gameplay claim.",
  "sources": [
    {
      "kind": "manual",
      "source": "placeholder",
      "offset": null,
      "observation": "This template is not evidence."
    }
  ],
  "tests": [],
  "notes": "Never promote status just because a value looks plausible."
}
