{
  "id": "win1014-predictor-launch-clear-air-parity",
  "status": "parity-verified",
  "claim": "The portable arithmetic exactly reproduces the Windows v1.014 internal predictor launch at 0x40C84F plus the tested normal clear-air path for three controlled cases.",
  "sources": [{
    "kind": "windows-executable",
    "source": "GOLFWIN.EXE v1.014 SHA256 3ab09a789ae3d11ffe6636def32f5d1c00f2930ad4068bf6dc1420ceac7f1ec8",
    "sha256": "3ab09a789ae3d11ffe6636def32f5d1c00f2930ad4068bf6dc1420ceac7f1ec8",
    "offset": null,
    "observation": "Original predictor machine code executed in Unicorn matched 58 portable-core samples with zero mismatch."
  }],
  "tests": [
    "GitHub Actions run 37519158957",
    "artifact sha256:d8f04345c8dfb7fac8defe6b17afe38c5b3b716bf2c426f10a4f613077c617df"
  ],
  "notes": "Call-site analysis performed afterwards classified 0x40C84F/0x40CB00 as an internal predictor/simulation path. This evidence must not be represented as live-player launch parity. Live launch is 0x40AD1D."
}
